name,description
調達品選定・管理,"・プロジェクトに必要な物品・サービスの選定および管理を行うことができるスキル。
・具体的には、調達対象の仕様整理、ベンダー選定、RFP（提案依頼書）の作成、契約条件の調整、納期・品質・コストの管理などのスキルが該当する。
・特に、宇宙分野においては、信頼性・安全性が求められる部品やサービスの調達において、技術仕様の適合性評価や、厳格な納期・品質管理が求められる。"
財務会計,"・企業活動における財務情報の記録・分析・報告を行う技能。
・具体的には、予算策定、原価管理、決算業務、仕訳、財務諸表の作成、監査対応、税務処理などのスキルが該当する。
・特に、宇宙分野においては、研究開発費の管理、国際共同事業における資金調整、政府助成金の会計処理等の場面で必要となる。"
資料作成・文書化,"・業務に関連する技術的・業務的情報を整理し、関係者に共有可能な形で文書化することができるスキル。
・具体的には、報告書・手順書・マニュアル・提案書・仕様書・議事録等の作成などのスキルが該当する。
・特に、宇宙分野においては、技術仕様や運用手順などの専門的文書を、国内外の関係者に正確かつ明確に伝えるスキルが求められる。"
資源マネジメント,"・プロジェクトの完遂に必要な資源（ヒト、モノ、カネ、情報等）を特定・取得・管理することができるスキル。
・具体的には、資源管理計画の策定、活動資源の見積もり、資源の取得、チームの育成・管理、資源コントロールなどのスキルが該当する。
・特に、宇宙輸送機や人工衛星の開発においては、多様な専門性を持った人材のスキルを把握し、必要に応じて人材配置を行うことが求められる。"
資源再生プロセス・技術,"・閉鎖環境下における資源再生プロセスおよびその技術に関する知識を有し、業務に活用できるスキル。
・水・空気・エネルギー等の循環設計、尿・湿気・洗浄水等からの水回収技術、フィルタ・蒸留・電気分解等の処理方式、統合的な資源管理に関する理解が該当する。
・特に宇宙分野では、限られた資源を効率的に循環させるための資源再生システムの構築が求められる。"
資金調達,"・負債や、出資、資産売却、補助金・助成金等を駆使して資本政策の策定・実行を行うことができるスキル。
・具体的には、経営層と連携しながら行う、VC・投資家との交渉、助成金申請、エクイティ・デットファイナンスの計画・実行、さらにプロジェクト単位での予算獲得・コスト管理などのスキルが該当する。
・特に、宇宙分野においては、技術開発や打上げ費用など高額な初期投資に対応するため、VC・政府支援・国際機関との連携による資金調達が重要となる。"
軌道設計・解析,"・宇宙輸送機や人工衛星のシステム性能を加味したうえで、効率的な宇宙機の運用目的達成のための軌道計算・解析を行うことができるスキル。
・具体的には、軌道力学に基づいた打上げ軌道・遷移軌道・運用軌道の設計や、軌道維持・変更に関する解析などのスキルが該当する。
・特に、宇宙分野においては、ミッション要求に応じた軌道選定や、衝突回避・燃料最適化に向けた軌道解析スキルが求められる。"
重機操縦,"・重機（大型機械）の操縦を行うことができるスキル。
・具体的には、フォークリフトやクレーン車等の重機の整備・操縦などのスキルが該当する。
・特に、射場においては、ロケットの輸送に用いるロケット用新型移動発射台運搬台車等の運搬が求められる。"
電子部品静電防止作業,"・宇宙機システムや電子機器の組立・試験において、静電気放電による機器の破壊を防止するために、必要な処置を行うことができるスキル。
・具体的には、静電気対策された作業環境の維持、静電気放電対策（ESD）管理手順の遵守などのスキルが該当する。"
電気コンポーネント（部品）設計・解析,"・宇宙機に搭載される電気系コンポーネント（トランスポンダ、変調器等）の設計・解析を行うことができるスキル。
・具体的には、信号処理・制御回路の設計、シミュレーション、部品選定、EMC対策、実装・試験までを含み、宇宙環境下で高信頼に動作する電気コンポーネントを具現化するスキルが該当する。"
電気推進システム設計・解析,"・人工衛星に用いられるイオンエンジン等の電気推進システムの設計・解析を行うことができるスキル。
・プラズマ物理学や耐熱性・腐食性に関する知識を有していることが望ましい。
※イオンエンジンとは、プラズマを静電加速して推力を得る静電加速型推進器のこと。"
電気的インタフェース設計・解析,"・異なるシステムや要素間が相互的に作用し、全体システムとして適切な要件を満たす動作を行うように設計・解析を行うことができるスキル。
・具体的には電力供給や信号処理等を加味した全体最適化などのスキルが該当する。
・特に、宇宙輸送機や人工衛星の開発においては、電力供給やテレメトリ／コマンド、制御信号、火工品機能、接地、地上支援装置、電気系システムの設計時において、電気的インタフェースの設計が求められる。"
電気設備管理,"・建物内で電力を安全かつ効率的に供給・管理するためのシステムや装置の整備・維持・運用を行うことができるスキル。
・具体的には、配電設備や、非常用電源設備、通信設備、防災設備等の整備・維持・運用などのスキルが該当する。"
電源コンポーネント（パワーエレクトロニクス）設計・解析,"・宇宙機に搭載される電気コンポーネントの中でも、特に電源系コンポーネント（太陽電池パネル、バッテリー、統合化電力制御器等）の設計・解析を行うことができるスキル。
・具体的には、電力変換回路の設計、シミュレーション、部品選定、EMC対策、実装・試験に加え、電力制御アルゴリズムの設計や信頼性解析を通じて、宇宙環境下で高信頼に動作する電源コンポーネントを開発・具現化するスキルが該当する。"
非破壊検査（X線・超音波・浸透探傷）,"・溶接部や接合部の内部欠陥を検出するために、X線、超音波、浸透探傷検査を企画・実施できるスキル。
・溶接作業や接着作業後に実施する。"
飛行安全管理,"・宇宙輸送機の飛行に伴う安全管理を行うことができるスキル。
・具体的には、ロケットや地上系の設備に関して有事を想定したシミュレーションや、打ち上げ当日の気象状況をもとに最終的な飛行経路を算出し、その経路について飛行安全の見地から問題がないか確認するなどのスキルが該当する。"
